{
  "_meta": {
    "generated": true,
    "do_not_edit": true,
    "source": "scripts/prediction/run_pipeline.py",
    "phase": "episystem-canonical",
    "epistemic_source": "heuristic_v1",
    "registry_mutation": false,
    "voices": [
      "freeman",
      "macgregor",
      "mercouris"
    ],
    "trajectory_count": 17
  },
  "interpretation": "multivoice_dataset",
  "trajectories": [
    {
      "event_id": "china_tariff_capitulation_2025",
      "voice": "freeman",
      "trajectory": [
        {
          "timestamp": "2025-04-04",
          "claim": "Um and a final point is u you know given the uh tariff tantrum that Mr. Trump has just uh thrown on the world, Iran's actually very fortunate. You don't have much trade with us",
          "stance": "no",
          "probability": 0.25,
          "confidence": 0.72,
          "interpretation": "probabilistic_projection",
          "speech_act": "initial",
          "capture": "source-archive/statecraft/2025-04-04/source-dialogue-works-mohammad-marandi-larry-wilkerson-and-chas-freeman-on-middle-east-erupts-iran-challenges-ultimatum-2025-04-04.md",
          "quote_speaker": "freeman",
          "public_display": true
        },
        {
          "timestamp": "2025-04-22",
          "claim": "There will be no um capitulation preemptive or otherwise by the Chinese. Uh they have an intense pride in the their own achievements.",
          "stance": "no",
          "probability": 0.25,
          "confidence": 0.72,
          "interpretation": "probabilistic_projection",
          "speech_act": "initial",
          "capture": "source-archive/statecraft/2025-04-22/source-judging-freedom-amb-charles-freeman-will-china-cave-on-trumps-tariffs-2025-04-22.md",
          "quote_speaker": "freeman",
          "public_display": true
        },
        {
          "timestamp": "2025-07-29",
          "claim": "there are uh capitulations by foreigners uh to bullying. Um there's no meeting of the minds. There's no mutual benefit. For example, Europeans are pointing out and by the way, they using the term unequal treaties to parallel the kind of impositions that were made on China in the 19th century by imperialist powers including us",
          "stance": "no",
          "probability": 0.25,
          "confidence": 0.7,
          "interpretation": "probabilistic_projection",
          "speech_act": "restated",
          "capture": "source-archive/statecraft/2025-07-29/source-judging-freedom-amb-charles-freeman-does-israel-recognize-its-own-genocide-2025-07-29.md",
          "quote_speaker": "freeman",
          "public_display": true
        },
        {
          "timestamp": "2026-02-24",
          "claim": "Why haven't the Iranians capitulated in the face of all the force that the United States has deployed? half of the US Air Force, two of the three active aircraft carriers would be",
          "stance": "no",
          "probability": 0.25,
          "confidence": 0.7,
          "interpretation": "probabilistic_projection",
          "speech_act": "restated",
          "capture": "source-archive/statecraft/2026-02-24/source-judging-freedom-freeman-israel-pushes-us-into-another-endless-war-2026-02-24.md",
          "quote_speaker": "freeman",
          "public_display": true
        },
        {
          "timestamp": "2026-03-17",
          "claim": "Did uh Trump dump China, or did China dump Trump? The Trump-Xi meeting is now [clears throat officially off. My own view is that President Xi didn't want a picture",
          "stance": "no",
          "probability": 0.25,
          "confidence": 0.7,
          "interpretation": "probabilistic_projection",
          "speech_act": "restated",
          "capture": "source-archive/statecraft/2026-03-17/source-judging-freedom-freeman-will-china-dump-trump-2026-03-17.md",
          "quote_speaker": "freeman",
          "public_display": true
        }
      ],
      "alignment_score": 1.0,
      "entropy_weighted_probability": 0.25
    },
    {
      "event_id": "gaza_ceasefire_holds_2025",
      "voice": "freeman",
      "trajectory": [
        {
          "timestamp": "2025-01-21",
          "claim": "I think anyone who thinks this deal was anything other than a pause in the genocide to facilitate an exchange of hostages is dreaming",
          "stance": "no",
          "probability": 0.25,
          "confidence": 0.72,
          "interpretation": "probabilistic_projection",
          "speech_act": "initial",
          "capture": "source-archive/statecraft/2025-01-21/source-judging-freedom-amb-chas-freeman-a-ceasefire-or-a-pause-2025-01-21.md",
          "quote_speaker": "freeman",
          "public_display": true
        },
        {
          "timestamp": "2025-10-10",
          "claim": "Israel has a perfect record of violating every ceasefire it agrees to. Uh the case of Lebanon is in point. Israel agreed to withdraw from Lebanon, agreed to a ceasefire. It has not withdrawn from Lebanon. It has violated the ceasefire 4,600 times.",
          "stance": "no",
          "probability": 0.25,
          "confidence": 0.88,
          "interpretation": "probabilistic_projection",
          "speech_act": "self_acknowledged_correct",
          "capture": "source-archive/statecraft/2025-10-10/source-india-global-left-gaza-ceasefire-wont-last-chas-freeman-2025-10-10.md",
          "quote_speaker": "freeman",
          "public_display": true
        }
      ],
      "alignment_score": 1.0,
      "entropy_weighted_probability": 0.25
    },
    {
      "event_id": "gaza_hostage_deal_jan_2025",
      "voice": "freeman",
      "trajectory": [
        {
          "timestamp": "2025-01-14",
          "claim": "if this happens which does seem likely uh it will be thanks to the intervention of Donald Trump um or so we are told Netanyahu has been brought to an agreement on the hostage exchange",
          "stance": "yes",
          "probability": 0.75,
          "confidence": 0.72,
          "interpretation": "probabilistic_projection",
          "speech_act": "initial",
          "capture": "source-archive/statecraft/2025-01-14/source-judging-freedom-amb-chas-freeman-netanyahu-instigating-war-with-iran-2025-01-14.md",
          "quote_speaker": "freeman",
          "public_display": true
        }
      ],
      "alignment_score": 1.0,
      "entropy_weighted_probability": 0.75
    },
    {
      "event_id": "gulf_crisis_macro_shock",
      "voice": "macgregor",
      "trajectory": [
        {
          "timestamp": "2026-06-26",
          "claim": "If we don't we're going to we're facing a global depression. That's what he said judge. So that's clear unambiguous evidence that President Trump understands the consequences. What he doesn't seem to be able to do is tie all the rest of this together back to Israel.",
          "stance": "yes",
          "probability": 0.75,
          "confidence": 0.72,
          "interpretation": "probabilistic_projection",
          "speech_act": "initial",
          "capture": "source-archive/statecraft/2026-06-26/source-judging-freedom-macgregor-judgment-day-trump-war-lost-2026-06-26.md",
          "quote_speaker": "macgregor",
          "public_display": true
        }
      ],
      "alignment_score": 1.0,
      "entropy_weighted_probability": 0.75
    },
    {
      "event_id": "iran_airpower_cannot_force_submission",
      "voice": "macgregor",
      "trajectory": [
        {
          "timestamp": "2026-06-26",
          "claim": "You want to bomb them until they submit to Israeli demands. Okay. What do we bomb? Show me the targets that are going to make make the Iranians change their minds and suddenly submit to Israel. That should never have happened. This whole thing should never have occurred.",
          "stance": "no",
          "probability": 0.25,
          "confidence": 0.72,
          "interpretation": "probabilistic_projection",
          "speech_act": "initial",
          "capture": "source-archive/statecraft/2026-06-26/source-mario-nawfal-macgregor-israel-furious-trump-turkey-syria-lebanon-2026-06-26.md",
          "quote_speaker": "macgregor",
          "public_display": true
        }
      ],
      "alignment_score": 1.0,
      "entropy_weighted_probability": 0.25
    },
    {
      "event_id": "iran_great_power_direct_war_entry",
      "voice": "freeman",
      "trajectory": [
        {
          "timestamp": "2025-03-28",
          "claim": "My expectation would be in the case of the Russians that they would accelerate the transfer of technology and weapons to Iran but would not involve themselves directly. Uh I don't see that they can create a diversion for US forces.",
          "stance": "no",
          "probability": 0.25,
          "confidence": 0.72,
          "interpretation": "probabilistic_projection",
          "speech_act": "initial",
          "capture": "source-archive/statecraft/2025-03-28/source-dialogue-works-amb-chas-freeman-will-iran-get-backup-from-russia-and-china-against-the-u-s-2025-03-28.md",
          "quote_speaker": "freeman",
          "public_display": true
        },
        {
          "timestamp": "2026-04-28",
          "claim": "Freeman reads the Russian dimension as material enough to affect diplomacy, UN positioning, and the broader stamina of the anti-Iran coalition.",
          "stance": "uncertain",
          "probability": 0.5,
          "confidence": 0.65,
          "interpretation": "probabilistic_projection",
          "speech_act": "iterated",
          "capture": "source-archive/statecraft/2026-04-28/source-judging-freedom-freeman-what-russia-can-do-for-iran-2026-04-28.md",
          "quote_speaker": "operator_summary",
          "public_display": false
        }
      ],
      "alignment_score": 1.0,
      "entropy_weighted_probability": 0.3686
    },
    {
      "event_id": "israel_sabotages_exit_ramps",
      "voice": "macgregor",
      "trajectory": [
        {
          "timestamp": "2026-06-26",